{
  "$schema": "./architecture-policy.schema.json",
  "version": 1,
  "currentPhase": "P4",
  "packages": {
    "@vykor/agent-contracts": {
      "directory": "packages/agent-contracts",
      "allowed": [
        "@vykor/environment"
      ],
      "removeByPhase": "P6",
      "migrationId": "M30"
    },
    "@vykor/host-config": {
      "directory": "packages/host-config",
      "allowed": [
        "@vykor/agent-contracts",
        "@vykor/environment",
        "@vykor/protocol"
      ],
      "removeByPhase": "P6",
      "migrationId": "M30"
    },
    "@vykor/execution-node": {
      "directory": "packages/execution-node",
      "allowed": [
        "@vykor/agent-contracts",
        "@vykor/host-config",
        "@vykor/environment",
        "@vykor/sandbox"
      ],
      "removeByPhase": "P6",
      "migrationId": "M30"
    },
    "@vykor/core": {
      "directory": "packages/core",
      "allowed": [
        "@vykor/agent-contracts",
        "@vykor/environment"
      ],
      "removeByPhase": "P4",
      "migrationId": "M15"
    },
    "@vykor/agent-runtime": {
      "directory": "packages/agent-runtime",
      "allowed": [
        "@vykor/agent-contracts",
        "@vykor/core",
        "@vykor/host-config",
        "@vykor/execution-node",
        "@vykor/api",
        "@vykor/auth",
        "@vykor/coordinator",
        "@vykor/environment",
        "@vykor/hooks",
        "@vykor/jobs",
        "@vykor/mcp",
        "@vykor/memory",
        "@vykor/permissions",
        "@vykor/plugins",
        "@vykor/prompts",
        "@vykor/protocol",
        "@vykor/sandbox",
        "@vykor/skills",
        "@vykor/terminal",
        "@vykor/terminal-node",
        "@vykor/tools"
      ],
      "removeByPhase": "P6",
      "migrationId": "M30"
    },
    "@vykor/api": {
      "directory": "packages/api",
      "allowed": [
        "@vykor/agent-contracts",
        "@vykor/host-config"
      ],
      "removeByPhase": "P4",
      "migrationId": "M15"
    },
    "@vykor/auth": {
      "directory": "packages/auth",
      "allowed": [
        "@vykor/agent-contracts",
        "@vykor/host-config",
        "@vykor/api"
      ],
      "removeByPhase": "P1",
      "migrationId": "M02"
    },
    "@vykor/permissions": {
      "directory": "packages/permissions",
      "allowed": [
        "@vykor/agent-contracts",
        "@vykor/host-config",
        "@vykor/environment"
      ],
      "removeByPhase": "P1",
      "migrationId": "M03"
    },
    "@vykor/hooks": {
      "directory": "packages/hooks",
      "allowed": [
        "@vykor/agent-contracts",
        "@vykor/host-config",
        "@vykor/environment",
        "@vykor/sandbox"
      ],
      "removeByPhase": "P4",
      "migrationId": "M15"
    },
    "@vykor/sandbox": {
      "directory": "packages/sandbox",
      "allowed": [
        "@vykor/agent-contracts",
        "@vykor/host-config",
        "@vykor/environment",
        "@vykor/protocol"
      ],
      "removeByPhase": "P1",
      "migrationId": "M02"
    },
    "@vykor/tools": {
      "directory": "packages/tools",
      "allowed": [
        "@vykor/agent-contracts",
        "@vykor/host-config",
        "@vykor/environment",
        "@vykor/execution-node",
        "@vykor/sandbox",
        "@vykor/coordinator",
        "@vykor/jobs",
        "@vykor/terminal",
        "@vykor/protocol"
      ],
      "removeByPhase": "P4",
      "migrationId": "M14"
    },
    "@vykor/coordinator": {
      "directory": "packages/coordinator",
      "allowed": [
        "@vykor/agent-contracts"
      ],
      "removeByPhase": "P3",
      "migrationId": "M07"
    },
    "@vykor/jobs": {
      "directory": "packages/jobs",
      "allowed": [
        "@vykor/protocol"
      ],
      "removeByPhase": "P6",
      "migrationId": "M30"
    },
    "@vykor/terminal": {
      "directory": "packages/terminal",
      "allowed": [
        "@vykor/protocol"
      ],
      "removeByPhase": "P6",
      "migrationId": "M30"
    },
    "@vykor/terminal-node": {
      "directory": "packages/terminal-node",
      "allowed": [
        "@vykor/environment",
        "@vykor/host-config",
        "@vykor/jobs",
        "@vykor/terminal",
        "@vykor/protocol"
      ],
      "removeByPhase": "P1",
      "migrationId": "M02"
    },
    "@vykor/services": {
      "directory": "packages/services",
      "allowed": [
        "@vykor/agent-contracts",
        "@vykor/host-config",
        "@vykor/protocol",
        "@vykor/memory",
        "@vykor/environment",
        "@vykor/sandbox",
        "@vykor/execution-node",
        "@vykor/core"
      ],
      "removeByPhase": "P6",
      "migrationId": "M30"
    },
    "@vykor/server": {
      "directory": "packages/server",
      "allowed": [
        "@vykor/agent-contracts",
        "@vykor/host-config",
        "@vykor/execution-node",
        "@vykor/core",
        "@vykor/agent-runtime",
        "@vykor/api",
        "@vykor/auth",
        "@vykor/permissions",
        "@vykor/hooks",
        "@vykor/sandbox",
        "@vykor/tools",
        "@vykor/coordinator",
        "@vykor/jobs",
        "@vykor/terminal",
        "@vykor/terminal-node",
        "@vykor/services",
        "@vykor/protocol",
        "@vykor/plugins",
        "@vykor/plugin-converters",
        "@vykor/plugin-sources",
        "@vykor/prompts",
        "@vykor/skills",
        "@vykor/memory",
        "@vykor/personalization",
        "@vykor/channels",
        "@vykor/commands",
        "@vykor/output-styles",
        "@vykor/themes",
        "@vykor/swarm",
        "@vykor/environment",
        "@vykor/mcp"
      ],
      "removeByPhase": "P6",
      "migrationId": "M30"
    },
    "@vykor/protocol": {
      "directory": "packages/protocol",
      "allowed": [
        "@vykor/agent-contracts"
      ],
      "removeByPhase": "P6",
      "migrationId": "M30"
    },
    "@vykor/client": {
      "directory": "packages/client",
      "allowed": [
        "@vykor/protocol",
        "@vykor/agent-contracts"
      ],
      "removeByPhase": "P6",
      "migrationId": "M30"
    },
    "@vykor/plugins": {
      "directory": "packages/plugins",
      "allowed": [
        "@vykor/agent-contracts",
        "@vykor/host-config",
        "@vykor/protocol",
        "@vykor/skills",
        "@vykor/coordinator"
      ],
      "removeByPhase": "P4",
      "migrationId": "M15"
    },
    "@vykor/plugin-converters": {
      "directory": "packages/plugin-converters",
      "allowed": [
        "@vykor/plugins"
      ],
      "removeByPhase": "P6",
      "migrationId": "M30"
    },
    "@vykor/plugin-sources": {
      "directory": "packages/plugin-sources",
      "allowed": [],
      "removeByPhase": "P6",
      "migrationId": "M30"
    },
    "@vykor/prompts": {
      "directory": "packages/prompts",
      "allowed": [
        "@vykor/agent-contracts",
        "@vykor/host-config",
        "@vykor/environment",
        "@vykor/sandbox",
        "@vykor/memory",
        "@vykor/personalization",
        "@vykor/core"
      ],
      "removeByPhase": "P1",
      "migrationId": "M02"
    },
    "@vykor/skills": {
      "directory": "packages/skills",
      "allowed": [],
      "removeByPhase": "P6",
      "migrationId": "M30"
    },
    "@vykor/memory": {
      "directory": "packages/memory",
      "allowed": [],
      "removeByPhase": "P6",
      "migrationId": "M30"
    },
    "@vykor/personalization": {
      "directory": "packages/personalization",
      "allowed": [
        "@vykor/memory"
      ],
      "removeByPhase": "P6",
      "migrationId": "M30"
    },
    "@vykor/channels": {
      "directory": "packages/channels",
      "allowed": [
        "@vykor/protocol"
      ],
      "removeByPhase": "P6",
      "migrationId": "M30"
    },
    "@vykor/commands": {
      "directory": "packages/commands",
      "allowed": [],
      "removeByPhase": "P6",
      "migrationId": "M30"
    },
    "@vykor/output-styles": {
      "directory": "packages/output-styles",
      "allowed": [],
      "removeByPhase": "P6",
      "migrationId": "M30"
    },
    "@vykor/themes": {
      "directory": "packages/themes",
      "allowed": [],
      "removeByPhase": "P6",
      "migrationId": "M29"
    },
    "@vykor/swarm": {
      "directory": "packages/swarm",
      "allowed": [],
      "removeByPhase": "P6",
      "migrationId": "M29"
    },
    "@vykor/environment": {
      "directory": "packages/environment",
      "allowed": [],
      "removeByPhase": "P6",
      "migrationId": "M30"
    },
    "@vykor/mcp": {
      "directory": "packages/mcp",
      "allowed": [
        "@vykor/agent-contracts",
        "@vykor/host-config",
        "@vykor/protocol",
        "@vykor/environment",
        "@vykor/sandbox"
      ],
      "removeByPhase": "P4",
      "migrationId": "M15"
    }
  },
  "modules": [
    {
      "id": "portable-contracts",
      "fromPaths": [
        "packages/agent-contracts/src/"
      ],
      "allowed": [
        "@vykor/environment"
      ],
      "forbidBuiltins": true,
      "typeOnlyPackages": [
        "@vykor/environment"
      ],
      "removeByPhase": "P1",
      "migrationId": "M01",
      "allowExternal": []
    },
    {
      "id": "kernel",
      "fromPaths": [
        "packages/agent-runtime/src/kernel/"
      ],
      "allowed": [
        "@vykor/agent-contracts",
        "@vykor/core",
        "@vykor/environment"
      ],
      "allowSelfPaths": [
        "packages/agent-runtime/src/kernel/",
        "packages/agent-runtime/src/kernel-entry.ts"
      ],
      "removeByPhase": "P4",
      "migrationId": "M18",
      "fromFiles": [
        "packages/agent-runtime/src/kernel-entry.ts"
      ],
      "forbidSpecifiers": [
        "^(?:node:)?(?:fs|child_process|net|http|https)(?:/|$)",
        "^(?:node-pty|better-sqlite3|sharp)$"
      ],
      "allowExternal": []
    },
    {
      "id": "kernel-declarations",
      "fromPaths": [
        "packages/agent-runtime/src/kernel/"
      ],
      "symbols": [